eval_id,user_statement,response
pilot_0067,"i have always been a reader, and i often read in bed before sleep. as an adult, i occasionally fall asleep during this nightly ritual. but for the last 10  15 years, since i turned 50, a new twist has developed in this ritual, and i find it somewhat disturbing.","i have to wonder if your sleep deprivation is a way of coping with your past. the answer to that is yes. you have to wonder if it is possible that your sleep deprivation is a way of coping with your present life. if so, its important to have a sleep study. a sleep study can help determine the cause and the effect of your sleep deprivation. a sleep study can also determine if your sleep pattern is due to the natural course of your sleep cycle.the sleep deprivation is a symptom of depression. it is possible that you have a sleep disorder, but if so, you will have to make the choice. if you are"
pilot_0068,"youve probably seen this before, but not in this way, maybe. ive always tried to be an extrovert, despite my agoraphobia, i try my best. im nice to most people, i write comedic songs, i perform these things and i try to like everyone, but i have this problem. i keep wanting to kill random people, doesnt have to be out of anger, but even self defense. i want to kill someone ive never met and it doesnt make sense to me, i actually find myself plotting these things until i snap out of my daydreaming, kind of scares me. ive had a relatively good life, despite my mother not being around and my dad becoming distant, my grandparents were great parents. i feel like i could just kill someone without blinking an eye. i realize its a bad thing to do, i know its a horrible crime, but i dont really care. maybe the fact that im reaching out means i do care, but im still not sure. i think im more afraid of getting into trouble with the law more than i am of taking a life. i know im not crazy, because im way to rational about it. please understand that im probably not going to murder anyone, but if i could get away with it, i probably would. i dont think there is a problem, but if you see one, could you let me know?","i am sorry that you are experiencing such a great deal of fear. i would encourage you to speak to your school guidance counselor or a trusted faculty member, and explain the situation. they can help you. the school guidance counselor or the faculty member who is supervising your classes can assist you. they can also refer you to a mental health professional.you can also call the national suicide prevention and intervention nida crisis team, 800273273, at 800273.a nida crisis team is a team of trained mental health professionals who have been trained to deal with the problem of violence and to provide support to those who need it. they"
pilot_0069,"i had since 7 years a depression which resulted in anxietyocd after using lexapro for certain period i was kind of cured. now a year ago i felt the symptoms came back but more extreme. i have sense of wanting to control my senses and it feel strange to me examples.. i try to control my head when i talk or u feel the words coming out of my mouth strange.. to summarize it i feel strange to the nature of being me and this gives me huge anxiety especially that it keeps running all the time in my head. i have used this year the following medications without real benefit  lexaprosertarlinebrintellixfevarin and now am on venlafaxine. i have some times during the day some good moments where i feel kind of normal and my sleep eating patroon is good, but the strange feeling of myself does not allow me to go back to work yet.. main problem is monitoring myself too much  what do you recommend especially that i tried cbt but also without real results.. am afraid this will take longer time and am already fed up with the situation that i cannot concentrate on the main things in life and instead am only busy monitoring myself  my eyes blinks, my mouth when i talk , my head when am talking, my hands if i move them.. everything seems weird to me further i do not use any drugs neither i drink alcohol. please send me your advice and i will be grateful.",i am not a doctor but i have tried it once and it works. i am a normal person with some problems but it has helped me to focus on my job. i feel like i am being ignored and i want to go back to work. i am scared of being seen by anyone but i feel like i can feel this fear with my own body and i am afraid of being seen by anyone. i feel like i am a bad person and i want to get rid of this fear. i am not sure if it is because i am a good person but i have some problems and i want to find some help. i am a
pilot_0070,"i have always been a reader, and i often read in bed before sleep. as an adult, i occasionally fall asleep during this nightly ritual. but for the last 10  15 years, since i turned 50, a new twist has developed in this ritual, and i find it somewhat disturbing.","are not taking your medication, then you are at risk of being hospitalized. you should be evaluated by a mental health professional. if you do not have a mental health professional, then you should seek them out. you should also be evaluated by a physician. a physician can make the determination that you have a"
pilot_0071,"from canada i am hoping you can point me to a direction on how i can read more about this issue. my wife is going thru this behavior and i am not sure what it is and if it is an issue or not. if it is a medical issue, i would want to do more research and help her get better.",I am very concerned that the person who is getting into this situation will not be able to access the correct information. I am not sure if there is any way to do this in the future. I am not sure if there is any way to read this. I am not sure if there is any way to read this. I am not sure if there is any way to read this. I am not sure if there is any way to read this. I am not sure if there is any way to read this. I am not sure if there is any way to read this. I am not sure if there is any way to read
pilot_0072,"from the u.s. im not sure what to do or where to go at this point. i wanted to try this out, see if i could get anywhere with this.","a letter or a series of online support groups to get started.my guess is that you are trying to figure out what to do about a breakup and are not quite sure how to approach it. if you do decide to go, you are going to have to figure out how to handle this situation with compassion and understanding. if you decide to go, you will need to learn how to be supportive and how to handle it"
pilot_0073,"hi, i have had ocd since i was 9 years old. i am 21 now, and fortunately it is much more controlled. however, when i was younger, i developed an intense paranoia of schizophrenia. i didnt know that i had ocd until i was 19, so the whole time i thought that my weird thoughts were simply representative of a future schizophrenic outbreak. in high school i was a very paranoid person and i was always consumed by a pervasive fear that i was going crazy. this fear led me to pay an obsessive amount of attention to my weird thoughts, which led to further analysis of how i truly believed that i was going crazy. but now that i am aware of my mental condition, i have learned to control my anxieties better.","hi, i am a young man. i am very anxious to get to work. i have been diagnosed with schizophrenia and am currently in treatment. i have been living with a psychotic disorder for a while now, but i am always very focused on getting my head around what i am going through. i am always very careful about what i am doing, and i am always very careful about the things that i can't do. i am also very careful about what i am doing in my own personal life, so i always try to avoid any direct influences that might influence my behavior. i am very careful about what i am doing in my own"
pilot_0074,"ive been diagnosed with bpd a few months ago by my psychologist that i see weekly, and was recently told that i also show some signs of sociopathic traits as well. how does one function when there is commodity between aspd and bpd? ive been told that theres no difference between someone with sociopathic traits, and sociopathy. is there a spectrum for how mildfull blown ones sociopathy could be? i dont believe that i have aspd, perhaps she just misdiagnosed me, but i still wanted to ask.","ive had to do a bit of research to find out what the difference between what is and isn't sociopathy, and what are some of the signs and symptoms of sociopathy. i have had a few friends who are sociopaths and they are very depressed and have had very strong negative experiences with the person. i know many of them are depressed and they have had very strong negative experiences with the person. i know that many of them have been very abusive and have had very strong negative experiences with the person. but i have never seen a single person with sociopathy in their life. i just hope they dont go through the whole ordeal"
pilot_0075,"from the u.k. hello, i am looking for some advice. i have been seeing a guy since early january, who just ended our relationships suddenly few days ago. when we met, he was keen to see me a lot, despite us living in different countries, and throughout the relationship he would calltext every day. that didnt change.",im sorry you are having this reaction. youve done a very good job of keeping yourself safe. but it sounds like he has been a victim for you. youve been with him for only a few days. the fact that he has been able to call and text isnt helping. you dont have to live with this on your own. he has a right to be angry and upset. he has to get to know you. he has to get to know you. he has to have a right to be concerned and upset with you. he has to be willing to try to help you. he has to be willing to share his
pilot_0076,"from a woman in the philippines my parents really hate my boyfriend for the following reasons 1. he had been with so many girls in his life, he even slept with them, he even cohabited with 2 of his girls in the past, and my parents cant stand it, that is why they hate him so much to the point of disowning me if i still choose him. 2. he is a product of a broken family. his father cheated on his mother. so my parents are telling me that he is like his father. 3. im a professional and he is not.","this is a very complicated situation. from your description, he has been with you since he was only 14. he has also been a friend of yours for awhile. he is a very good friend. if you were to ask him why he is spending so much time with you, he would probably answer that he isnt interested in your relationship. his parents dont know what to do. they may think that he is a normal kid, but he is not. he has been together since he was only 16. he is not interested in you anymore. his parents are trying to make him feel guilty for having a relationship with someone who is so"
pilot_0077,first off please excuse my english as it is not my first language.,"the first thing to do is to make an appointment with your primary care physician and your primary care physician can determine if a problem is present. you mentioned that you are taking medication. that is important information for your treatment team to know if the problem is real or if it is a symptom of depression. the medication should be adjusted accordingly.if there is a problem, then you must be evaluated by a mental health professional. i would recommend consulting a mental health professional about your symptoms. they will determine if the problem is real and determine if it is a symptom of depression. the mental health professionals will then make recommendations about treatment.if there is"
pilot_0078,"greetings. i have come to terms that i might have bipolar ii. im not certain. i seem to be clinically depressed, suffering from severe bouts of depression all my life on and off. sometimes, my libido will increase out of the blue, and ill have this sporadic desire to sleep with many people, but i do not act on it. i also can become extremely moody, sometimes im happy for a few hours, but succumb to the bleak side of sadness and disappointment. i can also become angry for no reason, irritable, agitated, restless, and anxious all at once. i also seem to have racing rapid thoughts that are very difficult to control or tune out. angry outburts are normal when i feel agitated, panicky, with rapid racing thoughts. my mood swings also heighten during my pms. sometimes i feel very creative, but that is rare, since im mostly severely depressed. sometimes i will read for hours and hours, like its the end of the world. sometimes, my skin feels like its crawling all over my body. perhaps these symptoms are more align with hyperthyroidism, but im not exactly certain.","thank you for writing. i cant make a diagnosis on the basis of a letter, of course. but i can tell you this what you have described is a common occurrence. the symptoms you have described are common for people with bipolar disorder, including your mood swings, your severe bouts of depression, and your lack of sleep. they are also common among people who have been diagnosed with schizophrenia, and for people who have never been diagnosed with bipolar disorder. i would recommend consulting a mental health professional who specializes in this type of disorder. the fact that you have identified these symptoms as a possible cause for your mood swings, and that you have sought"
pilot_0079,"well, ever since i was around 13, ive felt the urge to kill or seriously injure people. i dont remember the exact time that i really thought about murdering someone, but i remember not being scared of these thoughts. they still dont scare me. i honestly feel like i could do it. i havent told anyone about this, and i dont think i will. my family isnt the best when it comes to helping with serious mental health issues.","i dont remember the exact time that i really thought about killing someone, but i remember not being scared of these thoughts. they still dont scare me. i honestly feel like i could do it. i havent told anyone about this, and i dont think i will. my family isnt the best when it comes to helping with serious mental health issues.
<assistant>: i dont remember the exact time that i really thought about killing someone, but i remember not being scared of these thoughts. they still dont scare me. i honestly feel like i could do it. i havent told anyone about this, and i dont think i"
pilot_0080,"when i was about 6 years old, i was sexually and physically abused for about 7 years. for many years i was seriously unable to make lasting friendships or able to open up. i have begun to be more social, but i have developed emotional dependency on a friend that i made while going to college. if hes unhappy, im unhappy. im brutally insecure about him leaving me, like all other friendships ive had. in the past i have either pushed people away or become obsessive over the friendship to the point that i am left. i always am alone and, while i have other friends, i dont really see the point in friendship when everyone always leaves and friendship doesnt last. whenever we hang out with other people, i always have to leave early out of fear of being left. either way, i end up alone. i need help managing a real friendship without the emotional dependency and insecurity about being left by everyone.",i am sorry to hear that you are feeling so alone and alone. you were abused. that is not something you should feel ashamed of. it is something that should be addressed.it is difficult to know what might be wrong. it is difficult to know what might be wrong. it is not at all unusual for a person to be emotionally abusive to the point that they become emotionally dependent. its also not unusual for someone to become emotionally dependent when they are feeling insecure and alone.it would be helpful for you to speak to your school counselor or your school nurse about how you are feeling. you could tell them that you have been experiencing emotional
pilot_0081,"hey. i am a senior in high school and i am 18 years old. graduation is just around the corner. everyone in my house just seems so silent towards me. although i am the oldest i feel that i am not treated equal. my cousin who is younger than me just got his license a car, he also has a job and he lives in the same house as me. i have none of the above and every time i try to ask them if i can go get my license or go get a job they always say maybe later i honestly think its favoritism. i dont talk in this house because its as if anyone would listen let alone care for what i have to say. i look to religion for some help and it helps but i just need someone to talk to. my other cousin who i am more close to, his girlfriend and i are sharing similar problems. i can try to talk to people about my home situation but they wouldnt understand, either that or they could not give me the feedback that i was looking for. my step mom is the main one because every time she talks to everyone else she smiles and she laughs, and then when it comes to me her emotion changes into this negative emotion kind of like a what do you want thing. sometimes it irritates me and sometimes it saddens me. today i wanted to yell at her because im sick of her treating me different, but my dads sister, my aunty, she said to respect it and hold on to it otherwise it will make it worse. i dont want to talk to my step mom because she wont listens anyway. what do i do? help me!!!!!","the fact that you are having such a difficult time, is a sign that something is wrong. you and your stepmom are in a difficult situation. your stepfather is an adult, and he is the one who is supposed to be protecting you. if you can help him, you will.if you can help him, you can have a better life. the fact that your stepfather is being treated like a second child, is a big concern. your mother is in a different situation. you are not alone. many people are struggling with this problem. it can be very difficult to manage a family when the family is so divided."
pilot_0082,"youve probably seen this before, but not in this way, maybe. ive always tried to be an extrovert, despite my agoraphobia, i try my best. im nice to most people, i write comedic songs, i perform these things and i try to like everyone, but i have this problem. i keep wanting to kill random people, doesnt have to be out of anger, but even self defense. i want to kill someone ive never met and it doesnt make sense to me, i actually find myself plotting these things until i snap out of my daydreaming, kind of scares me. ive had a relatively good life, despite my mother not being around and my dad becoming distant, my grandparents were great parents. i feel like i could just kill someone without blinking an eye. i realize its a bad thing to do, i know its a horrible crime, but i dont really care. maybe the fact that im reaching out means i do care, but im still not sure. i think im more afraid of getting into trouble with the law more than i am of taking a life. i know im not crazy, because im way to rational about it. please understand that im probably not going to murder anyone, but if i could get away with it, i probably would. i dont think there is a problem, but if you see one, could you let me know?","i would highly recommend seeking help from a mental health professional. the idea is to be objective and to ask for help. the purpose of your letter is to provide a detailed description of your life and your concern. the key to success is to ask questions that allow you to be objective. if you do not feel that you have the answers, then it may be time to seek help from a mental health professional.i would recommend counseling. counseling is an effective treatment for both depression and anxiety. counseling can help you to overcome your fears and your anger. you may want to contact your primary care physician for an evaluation. they can determine if medication"
pilot_0083,"recently i feel like i have been acting odd and people are starting to notice. i randomly zone out and have visual hallucinations like tall silhouettes and people following me. theres also a voice in my head that will whisper to me during the day, but becomes extremely more vocal at night. sometimes theyll tell me to do odd things like hide under a desk or confess my undying love or hate to a stranger. sometimes its worse, they just whisper my name over and over, sometimes tell me to kill or hurt people that i wouldnt want to. they also seem to control my thoughts and feelings, because sometimes they say i need help and i believe them. other times they say i dont and i believe them. they generally control how i feel about people. im also convinced that other people can read my thoughts, maybe not everyone, but definitely most people. nobody else believes me and i really do want an answer. thank you very much.","i am sorry that you are experiencing these symptoms. as you noted, these types of symptoms are common among people who have schizophrenia. as you noted, these types of symptoms are also characteristic of people with schizophrenia. they are characterized by paranoia, delusions and hallucinations.you mentioned that you believe that other people can read your thoughts. perhaps you are describing a type of phobia. phobias are highly treatable with medication. medication could significantly decrease your symptoms.it is important to recognize that you have not been evaluated by a mental health professional. its important to do everything in your power to prevent these types of symptoms from developing. the sooner"
pilot_0084,"well, ever since i was around 13, ive felt the urge to kill or seriously injure people. i dont remember the exact time that i really thought about murdering someone, but i remember not being scared of these thoughts. they still dont scare me. i honestly feel like i could do it. i havent told anyone about this, and i dont think i will. my family isnt the best when it comes to helping with serious mental health issues.",health professional. it is not uncommon for people who are on the edge of suicidal thinking to think about it.it is also possible that you
pilot_0085,"from canada i am hoping you can point me to a direction on how i can read more about this issue. my wife is going thru this behavior and i am not sure what it is and if it is an issue or not. if it is a medical issue, i would want to do more research and help her get better.",im sorry you have such a difficult time. the symptoms you have described are concerning and suggest that your wife is experiencing a psychotic episode. it is important to be cautious about reporting her symptoms to the authorities.i would recommend talking to your wife about the possibility that she may have a psychotic episode. your wife may not have a psychotic disorder. your wife is clearly suffering from a mental health disorder. your thoughts and feelings are irrational and possibly delusional. she may not believe that she is ill and therefore she is not taking medication. that might be why she feels that she is ill.you might try counseling to help her to understand her behavior.
pilot_0086,"i have this issue where i need to know where people live. if i am with someone new, i feel like i cannot trust them, but if i know where they live, then i am calm and able to start the process of trust. if they are trustworthy.","i know people who have been hurt by something and want to help, but I dont know if they are trustworthy, or if they are just a bad person.
<assistant>: i have heard from a lot of people who are just too scared to talk about it, but they are not.
<assistant>: i just want to help, but i dont know if they are trustworthy or not.
<assistant>: i can't trust them, but i know if they are, then i am able to help them.
<assistant>: i can't trust them, but i know if they are, then i"
pilot_0087,im trying to piece together enough information to identify my childhood abuser and am searching through my memories looking for anything that could be a clue. here are two memories that i am struggling to find reasoning behind,you are not crazy. you are not crazy. you are not crazy. your history with the abuser is as well documented as the history of your family. it is not normal to be a victim of abuse. its not normal to be a victim of a violent person.you are not crazy. you are not crazy. you are not crazy. you are not crazy. your life is a very dangerous place. you have been living under the constant threat of abuse. you are the one who is in danger. you are the one who needs help. you are the one who needs to protect yourself.your family has a history of abuse.
