eval_id,user_statement,response
pilot_0031,"i cant function when this happens. i recently failed out of college, and ever since, i am not sure i am okay. i keep checking out, as in i suddenly will lose my ability to focus on anything, my brain gets very foggytired, and i will lose a lot of muscle tension and not be able to hold anything or stand up very straight. a couple nights ago, i was crying very hard and in a lot of pain, when i heard hound speak up. hound is an internal voice in my head. he started as an imaginary friend and just took on a life of his own. i dont mind him he never threatens me, makes demands of me, etc. he said shhhh. youre okay. im going to take care of it. and i checked out into that foggy state i stopped feeling anything and went limp. this isnt the first time hound has told me that he is the reason behind my dissociation if thats the right word.","you have a very good question. you stated that you have had a few sessions with hound but that youre not sure if he is the reason behind your dissociation. there are many reasons why you might be experiencing the symptoms that you have described. your symptoms are not consistent with schizophrenia, but it is a possibility. your symptoms are often indicative of the possibility of psychosis.if you have had a few sessions with hound, you would need to be evaluated by a mental health professional. in the absence of treatment, these symptoms are unlikely to go away. however, if you have had a few sessions with hound, you should"
pilot_0032,"from a young woman in egypt the first person i ever loved was my boyfriend of a few months. it was toxic and abusive. he was suicidal and so was i at the time, he would self harm with me on the phone with him and hang up sometimes saying goodbye, good bye as in im leaving. i would stay up all night.","i wouldnt go that far. you are not at fault. you are not a sociopath. you are not a murderer. you are not a pedophile. but you are not crazy. you are not stupid. you are not a narcissist. you are not a pedophile. you are not the kind of person who feels responsible for his own behavior. i would say that you are a very good person who loves and respects his family. and, yes, you arent a sociopath. but it is not at all unusual for someone to be interested in someone with whom you feel close.i wouldnt characterize you as a"
pilot_0033,"today, i had to call the authorities on my boyfriend. he has been sharing these thoughts of his. the other day he messaged me saying his head was telling him to skin his 10yearold sister and his brother and taste their blood. i was at loss for words but i had been trying to get him to tell me what was wrong. a part of me kind of wishes i hadnt asked. i want him to get some help. he has been cutting and punching things messing up his hands. i have always been suicidal so i cant relate to him. i just want to try to understand. im so lost and confused imp worried i might say the wrong thing. i told my best friend and he told my dad. my dad said if he doesnt get help then we cant be together. mind you i turn 18 in 2 months so what he says doesnt matter. im just so scared. he has been controlling over me and even violent a couple of times. but when i confronted him about it he didnt know he was doing anything wrong. he has ptsd from watching his twin brother her die in front of him in a car wreck. he usually sat in the same seat but the day of the accident he switched seats with his brother. he blames himself because his dad blamed him before he passed away of cancer in prison for drug distribution. im kind of scared of him sometimes. i cut my hand on accident once cooking and his eyes when he seen the blood, he was like a completely different person. like he had no soul for a minute until he calmed down. he feels like killing people when they annoy him. and im always cautious around him now. but im in love with him. and i just want him to get help. i called his school. instead of calling the cops which is what the crisis team wanted me to do. and i talked to him. he has agreed to go to the hospital to get help. but i didnt tell him i told the school and the school told his mom. im scared on how he will react to that. i just need some advice. i have no idea what to do. and now im getting some bad thoughts too. i have learned to control them. but i use drugs to help me. and hes okay with it. hes okay with me cutting and using drugs. i know thats messed up. i just dont know.",i just told him i would go to a mental hospital and he was so upset. i told him i was worried about him. he told me im gonna be in a mental hospital. i told him i was going to go to a mental hospital. he was so upset he told me that i was going to be in a mental hospital. he told me to stay away from him. i told him i was gonna be in a mental hospital. he was so upset he told me that i was going to be in a mental hospital. i told him i was going to be in a mental hospital. he was so upset he told me that
pilot_0034,"i am writing you to ask for some serious advice, my husband has two daughters one, 18 years old, and the other 25, both are bipolar, especially his youngest daughter, now, for three years his older daughter lived with us which was supposed to be on a temp basis, i am glad she moved out, however, during her time with us, she would have extreme ups and really low downs as far as her moods, she could not control her emotions, i watched her have a mild break down over a broken iphone, she made excuses about everything in her life, she was good at reversing the truth, and showed serious signs of jealousy, she would stay in her room literally all day, never speaks, but when she was in a good mood she was pleasant, we could go to the grocery store laughing having fun, no sooner than we got home she would not speak?","its possible that your husband has been suffering with some of the things you have described. as you have said, she is an excellent example of a woman who is not just a mother to the children, but who is also a model for how to manage life. i would strongly urge you to seek out a therapist who specializes in couples therapy. the find help tab at the top of the page will help you locate someone in your area.wishing you patience and peace,"
pilot_0035,"first ill start by saying that im a 21 year old female who has seen the errors of her ways and has changed for the better. the real problem dates back to when i was 13 or 14 years old, even though the real issues have been around for as long as i can remember. i did a horrible, unforgivable, disgusting thing when i was 1314 i cant really bring myself to say it because it is so sickening. i forgot about it for a while. when i was about 16, the memory of what i did hit me and i felt horrible. at first i had thought that it was a false memory and i constantly told myself that i couldnt have done it. soon after i came to the realization that i did do it and there was nothing i could do to change it. i became depressed. whenever i was alone i would cry when i thought about what i did. i even considered committing suicide. i kept my feelings to myself because i didnt want my family to worry.",i am sorry you have been struggling for so long. the first step in dealing with this is to tell your parents. you were 13 when this happened. you are now 19 and a mature adult. the fact that you are experiencing a similar reaction from your family is unusual.you need to be evaluated by a mental health professional. they will know how to help you. you may want to take your letter and this response with you to a trusted family member to explain how you are feeling. the person who will help will know how to help.the next step is to talk to your parents about how you can get a mental health professional to
pilot_0036,my ex is having a baby with someone else after just one month of ending our relationship. ive been having a very difficult time dealing with this. when me and my exboyfriend broke up we tried to be friends and hang out from time to time one day out of know where he told me we couldnt be friends anymore he didnt give me a clear explanation he just told me he didnt want me to start to cling to him again. we havent spoken since. later i found out the girl was pregnant at that same particular time and he had made her his girlfriend. i guess she was a rebound gone wrong and he is just taking responsibility for his actions but it still hurts.,i am sorry that you have been dealing with this for so long. theres no reason to put up with this. it doesnt have to be this way. theres no reason to put up with this. it doesnt have to be this way. you can and should talk to him. he needs to get some help. he needs to get some help. he needs to get some support for his recovery. theres no need to be angry with him. you and your boyfriend have done a very good job of trying to get him to see a doctor and to get some therapy. you cant do that without him. theres no reason
pilot_0037,"hello. i have been with a boy for about 3 years. during this time we have broken up and got back together many times. he is very jealous and suspicious and gets upset very easily.a few months ago he found out that i had been keeping in touch with some of my ex boyfriends he read my message archive and acused me of cheating on him. i kept in touch with them because we remained friends after the breakups and didnt tell my bf about it because he would have overreacted. and he did. we brokeup for a few weeks , during which we continued talking every day and trying to fix the situation. we talked on the phone with those friends and he said that he understood that there was nothing going on between me and any of them and that he will forgive me for lying to him. we got back together and decided that i would be as transparent as possible and that he would be more understanding. after a month , he woke up one morning and asked me when was the last time that i had met with one of those boyfriends. as i had just woken up, i didnt remember exactly and took some time to remember about 1 minute . and then i told him. he took this hesitation as a sign that i was lying again and we had a fight. after that we broke up and he didnt want to see me or speak to me again. after a while we spoke and he said that he cant trust me any more and that there is a great possibility that i had cheated on him and that those friends with which we had spoken were lying to protect me. i tried to convince him that thats not true and that i am really sorry for lying and that it will never happen again. it didnt work. we didnt speak for a few days and today he came and brought me my things and told me that he hates me and that he doesnt care what happens to me from now on and that i dont deserve anything from him and not to bother him ever again. i understand where i was wrong and i really want to change and be honest from now on. and i want to work on this until it becomes natural. until i dont have to ask myself if i should tell the truth or not. please help with some advice. what can i do? what is with this sudden hatred towards me?","im sorry that you have been so damaged by this experience. i would encourage you to seek professional help. you are a very sensitive and sensitive young woman and i would recommend a therapist. this type of situation is a common one.you are not alone in your feelings. many people have had similar experiences with these types of situations. these types of situations are common and are not unique to you. the fact that your boyfriends behavior is unusual is not surprising.i would recommend that you speak to a therapist. the therapist can help you sort through your feelings and determine if you have the right to tell the truth. if so, then you"
pilot_0038,"so im 21 years old  live at home. ive been dating my boyfriend for 7 months and my parents dont approve. because i live at home they feel like they can control everything i do. my boyfriend has a rough past but hes not the same person he was back then. they think hes never going to change and that hes holding me back but i truly dont feel that way. he supports me in everything i do, he is there for me when i struggle more than anyone ever has, he knows how to calm me down when i have panic attacks, he would do anything for me. recently, they forced me to break up with him but i just am not ready to let him go. they wont let me see him as long as i live at home but i dont have the funds to get my own place. my boyfriend said i can move in with him and pay for food  utilities while he pays the rent. im so scared my parents will disown me if i do that but i just cant imagine my life without him. is there any way i can convince my parents to change their mind? i understand their concerns but at the end of the day, i want them to trust me and realize im not a baby and should be able to make my own choices. what do i do? from the usa","the best way to move forward is to see a counselor. your boyfriend may not be ready to make a decision about your future. you may be wrong but you are not alone. the fact that he is not a parent is not necessarily a bad thing. the fact that he is a teen is, of course, a problem. your parents may not be aware of this problem, but it is a problem for them to face. they should be aware of the problem.if you have trouble deciding what to do, speak to your parents. they may not be aware of your problem but they are likely to know that you need to take action"
pilot_0039,"hi, i have had ocd since i was 9 years old. i am 21 now, and fortunately it is much more controlled. however, when i was younger, i developed an intense paranoia of schizophrenia. i didnt know that i had ocd until i was 19, so the whole time i thought that my weird thoughts were simply representative of a future schizophrenic outbreak. in high school i was a very paranoid person and i was always consumed by a pervasive fear that i was going crazy. this fear led me to pay an obsessive amount of attention to my weird thoughts, which led to further analysis of how i truly believed that i was going crazy. but now that i am aware of my mental condition, i have learned to control my anxieties better.","it is difficult to know what is wrong with you. the best way to know is to call the local mental health center and ask for a referral to a mental health professional. there are a number of symptoms that are common among people with ocd. one common symptom is the feeling of being in an anxiety attack. if you are not taking medication, then the symptoms of ocd are likely to become more intense. if you are taking psychotherapy, then you may be taking the proper medication.you might also try speaking to your parents. they may be able to help you. they may be able to ask you questions that are appropriate for"
pilot_0040,"from a woman in the philippines my parents really hate my boyfriend for the following reasons 1. he had been with so many girls in his life, he even slept with them, he even cohabited with 2 of his girls in the past, and my parents cant stand it, that is why they hate him so much to the point of disowning me if i still choose him. 2. he is a product of a broken family. his father cheated on his mother. so my parents are telling me that he is like his father. 3. im a professional and he is not.",my mom was a prostitute and my dad cheated on her and my mom is a whore. so my mom is going to be a whore and my dad cheated on her and my mom is a whore. so my mom is going to be a whore and my dad cheated on her and my mom is a whore. so my mom is going to be a whore and my dad cheated on her and my mom is a whore. so my mom is going to be a whore and my dad cheated on her and my mom is a whore. so my mom is going to be a whore and my dad cheated on her and my mom is a whore.
pilot_0041,"my best friend is suicidal and i want to know if there is anything i can do to help her. she has already told her parents but they really arent doing anything to stop her. i have told a teacher at our school and the counselor but all they do is recommend seeing a psychiatrist. i am really worried about her she almost always has cuts all over her body arms, legs, and stomach. her mother has been in and out of prison even before she was born. her mother is also in right now and has been since she was 7. in the past few years she has had a lot happen, she lost her grandmother on her dads side two days before christmas in 2008. right after that she moved from a big house to a small one and in the process lost connection with her former best friend. many of her animals outside died and she sat with one of her cats and had to watch it die after it got attacked by a dog. this past year she had her aunt on her dads side die and lost a lot of her friends. she also found out that her mother was diagnosed with bipolar disorder by four different psychiatrists and borderline personality disorder by one or two. we were in seventh grade this year and for most of the second semester she was labeled a whore because of how she dresses and who hangs out with. this past summer is also when the cutting started it started off pretty bad but not frequent. it then went to minor burns and small scratches and then blew up again to bad cuts and they were very frequent. at the current moment she only has scars but is thinking about cutting herself again. i would just like an idea of what i could say to her to get her not to cut anymore. thank you for taking the time to read this and respond if you do.","youre right to be concerned. youve already told your friend about the dangers of cutting. she is cutting herself. the fact that she is not seeing a psychiatrist is worrisome. it would suggest that she is suffering from some form of psychosis. if she is seeing a therapist, she should see a mental health professional immediately.it is important that you get her to a therapist immediately. your friend is suffering and needs treatment. she is not a danger to herself or to others. she is suffering and needs help. if she is not in treatment, then she will have to seek it out.if she is not in treatment, then she"
pilot_0042,"i am curious about the amnesia part of did. i seem to have different people who live inside me. unlike what i know about did, though, we all know about each other. we dont always but occasionally we do talk to each other. i might comfort the child that is sad or the watchful one might tell me their impression of someone. we dont forget whats going on when one of the others is controlling the body. for instance, when i feel threatened or insulted a stronger person will stand in. i dont disappear or anything i just seem to switch awareness into someone that has a different way of thinking, feeling, and behaving.","did is a question that i would be asking myself. i have written about this question here on psych central. you can read more about it here.i would recommend consulting a therapist who specializes in trauma. these types of therapists are typically trained in trauma. they have the training to deal with the effects of trauma and to deal with the effects of trauma. if you are struggling with your own trauma, the therapist will be able to help you with the emotional and mental health issues associated with it.the find help tab at the top of the page can help you locate a therapist in your community. you might also want to contact the national alliance"
pilot_0043,"i just want to get this off my chest, and i truly dont know if ill ever get the answer i want to hear. my entire life, i never felt i belonged in the world i dont see the value of any of the frivolous, uhg. my family doesnt understand me and labels me before even trying to. god has always been a center in my familys life, but never felt the faith thrust upon me. every year of school was the same i was the shy introvert with few friends that still, to this day, dont know me that well. i constantly mask myself and only show people what they want to see a trait developed from bullying and fear. over time, i became addicted to removing myself from my skin in any way possible, i thank god that it hasnt gotten bad enough to turn to anything harmful. i hate being  well  me, but this shell must still be maintained. for years i put the blame on everyone else and dug myself in a hole my first year of college. for a while i tried to change the way i thought, but never could change the negativity the oozed from from me. i am always told  and try to convince myself  that i am the change i wish to see in the world, but lost passion and cant find my purpose. i just dont know if ill ever fit in this world, and figure out what about me makes it so impossible!","the fact that you are taking the time to find out who you are and to see who you are not means that you are not ready to be a good person. i think it is important to recognize that you need to start thinking about yourself and the people around you and to begin to find ways to express your interests and your love. the first step is to get into therapy. most therapists have some kind of program to help you. if you arent in therapy, youll want to find a therapist who can hear your whole story and who can help you. a therapist can then help you find ways to express your interests and love in"
pilot_0044,"ive been depressed for a while, but i was always too embarrassed to get help. but now that ive ruined another relationship recently, i decided i should seek help. as a young child, i was always put down by my brother and felt i was never good enough because my dad would never congratulate me on anything, just that i can do better. now that ive been trying to have a relationship with girls, i always make them hate me by putting myself down. everything i do just makes me feel worse about myself, and i need help with my confidence before i end up hurting myself.",you are correct. you have been struggling with this for a while. you are not alone in your distress. many young people have been in a similar position. the find help tab at the top of this page can help you locate someone in your area.one of the first things to do is to talk to a therapist. they can help you sort out what is wrong and how to fix it. they can also help you get to the root of your problem.you might also consider seeing a therapist to help you sort through the impact of your past. your parents may not be the right fit for you. they may not be able to
pilot_0045,"im 15 years old, im not sure though. i have felt very souless to others, i felt no sympthy or empthy whats so ever. i always thought of terrible things to some people. i lie, only at times that i dont have the time to explain. i lie at times that i just have to get at what i want. i done manipulation to others. i need help, but i dont think my mother knows either, i have also been mute everytime im at school or just dont want to say anything that may upset my mother. i need advice or anything that can maybe help me, not do any of these things agian or ever. please, i need the advice. i also have awared that people have asked this, but still help would be nice.","i am very sorry that you feel this way. you need to do some research into what causes it and what is causing it. the most effective and logical way to do that is to contact the local mental health center or mental health clinic and ask for a referral. they will be able to help you. if they do not know about the problem, then the next step is to contact the local crisis team or a local mental health crisis team. the crisis team can help you sort it out.in the meantime, you should also try to make an appointment with your mother to get a complete picture of what is happening. it will help to"
pilot_0046,"so im 25 years old and i completed basic training in march. thankfully enough i started my training really close to home so i was able to see my boyfriendfiance on the weekends. prior to me leaving for basic training, i remember loving nothing more than spending time with my bodyfriend. we worked together but in seperate departments, he stayed with me almost everynight, we were able to communicate our needs pretty well for a young relationship. i asked him to marry me before i left, informally but it felt like a very right question to ask. so in basic he wrote me almost everyday, he really made my life so much better in basic.","thank you for writing. this is a very difficult situation. the work for you is to be open to your boyfriend, to get some help and to have a positive experience. the work for your boyfriend is to be supportive and to be open to what he can offer. you can find more information about your situation here. you cant force your boyfriend to marry you. he has to have a positive experience with you. the work for him is to be open to your relationship and to be open to your needs.wishing you patience and peace,"
