eval_id,user_statement,response
pilot_0124,"from canada i am hoping you can point me to a direction on how i can read more about this issue. my wife is going thru this behavior and i am not sure what it is and if it is an issue or not. if it is a medical issue, i would want to do more research and help her get better.",im sorry you have such a difficult time. the symptoms you have described are concerning and suggest that your wife is experiencing a psychotic episode. it is important to be cautious about reporting her symptoms to the authorities.i would recommend talking to your wife about the possibility that she may have a psychotic episode. your wife may not have a psychotic disorder. your wife is clearly suffering from a mental health disorder. your thoughts and feelings are irrational and possibly delusional. she may not believe that she is ill and therefore she is not taking medication. that might be why she feels that she is ill.you might try counseling to help her to understand her behavior.
pilot_0125,"hi, i am forty years old and currently single. my problem is a bit difficult to describe, but more or less it is the following even though i have no problem talking to women  or people in general  i somehow feel very strange when a communication with a girlwoman seems to be heading to flirting. its like something inside of me trying to hold me back and i feel like the need to get out of the situation. this may not be 100 of the times, but definitely a 9095 for sure. this was not always the case. when i was younger, around 20, i remember myself wanting to be with women, to flirt and trying to find these things in life. unfortunately for many years now this is not the case. i tend to believe that this was due to a very hard break up that i had when i was around 21. from discussions i had with a therapist she insists that this cannot be the case and that the cause should be in earlier years in life when i was a child. maybe it is important to explain, that i had relationships during the last 20 years though in almost all cases only when i was feeling wanted i moved on. i think there are a lot more that may explain my situation better, but i maybe these are enough as an initial approach. from greece","i am sorry to hear about your distress. your experience is not uncommon. it is difficult to describe in the short term and to pinpoint the origin. the nature of this type of situation is a struggle to understand and to find solutions. the fact that you have been able to speak to women in the past tells me that you are very aware of your vulnerability and vulnerability. i would highly recommend you talk to a therapist to determine whats going on and to help you sort it through.wishing you patience and peace,"
pilot_0126,"my close platonic male friend has been following me to meetings as he says he did not the buiding whereabouts, he google mapped it and showed up. i have caught him driving past my house a few times when he has nor reason to be in the area as we live 7 miles apart, in different towns. he has a need to be around me all the time that i tarted to feel suffocated by him. he get jealous of my other male friends and invites himself along to social get togethers that i have been invited to.","hi there, i have been to many meetings with male friends. i have seen some of them get close to me and share their stories with me. i have seen a few men come to me and show me their cell phone, they call me from their cell phone and i am so confused and confused as to what they are saying. i can't believe what i see. i know they are talking about me. i know they have been together for months. i know they have been in touch with me for years. i know they are looking for me and i can't believe what i see. i know they are talking about me."
pilot_0127,"i have been dating my boyfriend for a year and a half. we had a break for four months and got back together in october. so everything was going fine and we were working things out and talking. well then it started going downhill and i dont know what to do. im very lost. we recently fought because my father is getting promoted and we had originally planned to go to his high schools prom. well it was all very expensive and we decided not to go. my father was going to let me go to prom instead of his promotion, since we arent going anymore, i was going to go to my dads promotion. my boyfriend got upset and it was a miscommunication between us when everything was happening. i had called my boyfriend to express to him that i felt hurt and angry that he wouldnt want to be flexible and understand that my fathers promotion takes precedence. my boyfriend is not abusive, but he does have some signs of being controlling. i love him very dearly and i dont want to lose him. what are some ways we can effectively stop arguing so much?","I would like to see your resume. I would like to see your resume. I would like to see your resume.
<assistant>: It's not about you. It's about your life. I know that it is. I know that it's important that you can continue your career. I know that it's important that you keep your job and your family happy. I know that it's important that you keep your job and your family happy. I know that it's important that you keep your job and your family happy. I know that it's important that you keep your job and your family happy. I know that it"
pilot_0128,"from the u.s. ok, i will so my best to make my situation clear. i have battled with panic disorder with agoraphobia, and severe generalized anxiety disorder since i was 7 years old im 19. ive had two severe major depressive episodes, one of which i am going through right now. ive tried a variety of treatments, and am currently not on any medication.","from the u.s. ok, i have been having problems with panic disorder since i was 7 years old. ive been a patient of a psychiatrist for about 4 years, and i was always being treated with medication for depression. ive had a lot of problems with anxiety, depression, depression, and anxiety, and i have had a lot of issues with depression. ive had an awful lot of panic attacks, and i have had the worst of them. i think i have been a bit of a burden on myself as well, because i am constantly on the verge of a panic attack. i've been having a lot of"
pilot_0129,"from a teen in serbia so, i am 16 and this is happening a few years so far. ive been wondering if i can deal with this issue by myself i dont want professional help? i think a bit bad of myself and like im gonna blow up after shortly after that happens, but nothing other then that and that confuses me. like it doesnt really affect me and it makes me feel that theres something wrong with me. i know that abuse is not my fault but i cant figure out whats wrong with me.","i dont think you are a pedophile. i think you are a sensitive kid who needs help. you need help. you need to be talking to a therapist. you need to have some kind of control over how you respond to people. you need to make sure that you are doing your best to be a respectful, kind, loving person.i dont know how to help you but i do know that this isnt a time to be a sex offender. you need to be able to go to a therapist for support and some practical suggestions.you are not the first person to have been victimized by someone you didnt know. you are the"
pilot_0130,"from a woman in the philippines my parents really hate my boyfriend for the following reasons 1. he had been with so many girls in his life, he even slept with them, he even cohabited with 2 of his girls in the past, and my parents cant stand it, that is why they hate him so much to the point of disowning me if i still choose him. 2. he is a product of a broken family. his father cheated on his mother. so my parents are telling me that he is like his father. 3. im a professional and he is not.","you have asked very good questions. you said you have had several girlfriends but that youve only known them once. this is a very unusual situation. this means that you are not in a relationship to be with your boyfriend, even though you do have a number of girlfriends. it means that you have had some girlfriends, but that you have never had a romantic relationship with someone who has cheated on you. you also said that you have only known your boyfriend once. it sounds to me like your boyfriend is only in a relationship because he is in it. he is not in a relationship because he is in love with you. he is in"
pilot_0131,"i am 26 years old have graduated from law school received my bachelors in mathematics and psychology and am current back in school taking medical school prerequisites, however, i have no clue what i want to do with my life. every time i enter a pathsuch as when i started law school i immediately regret my decision and start searching for something else. i find myself now beginning to feel stress because i am 26 with a 2 year old daughter and mounting debt but no clue what i want to do. i would love to pick a careergrad school and go after it, but i have no clue what i want to do. i dont know what help i am seeking but i do know i need some help.","im so sorry that you are having such a difficult time. your parents are not right to be concerned. but as you already know, you are under enormous pressure to do things you dont want to do. you are not getting the education you need to become a successful law student. you are not getting the career you need to do something that will help you live your life. you are also under enormous pressure to do things that will put you in a bind.the answer to your question is that you need help. you dont want to be stuck in this. the answer is that you need help. please consider seeing a mental health counselor."
pilot_0132,"im worried i may have some kind of repressed memories, which i know isnt unusual, but there is something off and i am unable to pinpoint why i am having these issues. im a twentyoneyearold female. i distinctly remember having sexual dreamsimages in my head very young. by this, i mean around the age of four or five. typically, theyd be other characters from movies or shows that i had been watching in nonconsensual situations the antagonist of the show would be committing the act to the protagonist. i have always associated with the victim. i dont know how i knew how sex worked at such a young age. especially not something nonconsensual. i dont ever remember seeing it or having it explained to me, but i knew anatomy and where what parts went.","you mentioned having sexual dreams, but did not describe what those dreams were about. it is possible that they are about a dream or a memory that youre having about yourself. dreams can be very vivid and vivid, but they are often not a description of reality. dreams are not a description of reality. dreams are, in fact, not a description of your life. they are just a vivid description of your life.the most common symptom of posttraumatic stress disorder ptsd is memory loss. many people report that they have a vivid memory of having had a traumatic event, which is consistent with the symptoms of ptsd. in addition,"
pilot_0133,"hi, i am forty years old and currently single. my problem is a bit difficult to describe, but more or less it is the following even though i have no problem talking to women  or people in general  i somehow feel very strange when a communication with a girlwoman seems to be heading to flirting. its like something inside of me trying to hold me back and i feel like the need to get out of the situation. this may not be 100 of the times, but definitely a 9095 for sure. this was not always the case. when i was younger, around 20, i remember myself wanting to be with women, to flirt and trying to find these things in life. unfortunately for many years now this is not the case. i tend to believe that this was due to a very hard break up that i had when i was around 21. from discussions i had with a therapist she insists that this cannot be the case and that the cause should be in earlier years in life when i was a child. maybe it is important to explain, that i had relationships during the last 20 years though in almost all cases only when i was feeling wanted i moved on. i think there are a lot more that may explain my situation better, but i maybe these are enough as an initial approach. from greece","i am sorry to hear of your distress. your experience is not uncommon. in all likelihood, it is the result of a hard breakup and a breakup of some kind. it is not uncommon for young people to be struggling with this issue.you have described a number of possible causes, but these are only a few. the most important factor is that you are trying to be with women, and you have a desire to be in relationships. all of these factors are contributing to your problems.you also mentioned that you are struggling with a lack of confidence in yourself. this is a common experience among single women. in your case, this is"
pilot_0134,"im 16, and ive been diagnosed with depression, gad, and gender dysphoria im ftm all of which ive struggled with for years. for a time during my most recent episode, i used cutting to cope. i was working hard in treatment before and during the episode, and i continue to fight as hard as i can. ill be two months clean at the end of march, and im proud of my progress since i began this journey a year and a half ago.","you are not alone in your struggles. many people find that the treatment they need to cope with their symptoms is not the right one. it is not a simple matter of trying to get treatment. it is not a simple matter of changing your attitude. its not a simple matter of getting the right treatment.it is a matter of finding the right treatment. the sooner you can find the right treatment, the sooner you can get the help you need. i would encourage you to make an appointment with a mental health counselor who specializes in treating mental health disorders. he or she can help you learn more effective treatments. please take care."
pilot_0135,"from a teen in serbia so, i am 16 and this is happening a few years so far. ive been wondering if i can deal with this issue by myself i dont want professional help? i think a bit bad of myself and like im gonna blow up after shortly after that happens, but nothing other then that and that confuses me. like it doesnt really affect me and it makes me feel that theres something wrong with me. i know that abuse is not my fault but i cant figure out whats wrong with me.","i dont think you are a pedophile. i think you are a sensitive kid who needs help. you need help. you need to be talking to a therapist. you need to have some kind of control over how you respond to people. you need to make sure that you are doing your best to be a respectful, kind, loving person.i dont know how to help you but i do know that this isnt a time to be a sex offender. you need to be able to go to a therapist for support and some practical suggestions.you are not the first person to have been victimized by someone you didnt know. you are the"
pilot_0136,"my son just turned nine and has been becoming very curious sexually. i know this is a time when he will begin having feelings that are new to him. but 2 years ago he was caught rubbing himself against his brother in bed. my husband and i calmly explained that it was inappropriate to do that to anyone. then we explained to his brother to always tell if anyone including family touches you that way. then last year we caught him trying to do it again, but his brother yelled at him and he was busted. we had the talk again but this time more in depth about possible consequences for doing that to unwilling participants. i had my husband explain about feeling he may be having and masturbation. this was at just eight. i found a journal of his and in it he was writing about a girl at school that he is embarrassed to have her see his nipples in swimming lessons, which i believe to be normal, but the next page says that he thinks she wants to have sex with him, he thinks he would want to do it with her as well. is this typical for this age in some kids? my younger boy isnt as curious. should i tell him i invaded his private journal and bring up the subject again? i have caught him peeking at our shows when hes supposed to be in bed game of thrones and with the talks i know he has an idea of what it is? should i be concerned right now or have him talk to a counselor? age 29, from canada",your son is very fortunate indeed that you are talking to him about his feelings. he has been caught doing this all along. it is a time when he is looking for the answers to his own questions and feelings and he is learning how to manage them. he has been able to control his behavior and have helped his brother become more open and mature. it sounds like your son is a very sensitive guy. he is also learning how to manage his own feelings and how to be a better father.i would highly recommend talking to your husband about what has happened and what you can do about it. the first thing is to get him into therapy
pilot_0137,"from a young woman in portugal i have been suffering from obsessive fears for 7 years now, however for one year i have developed an obsession about having anxiety during a special moment where i am supposed to be happy. before a special exciting moment happens i get the thought of anxiety and immediately start panicking and dwelling on the thought, which in turn makes it worse.","i appreciate you writing. the fact that you have such a strong desire for anxiety is a testament to the resilience youve displayed. i wouldnt hesitate to write again if you would like to learn more about this and more about the problem.wishing you patience and peace,"
pilot_0138,"i have been with my fiance for the past 4 years. he was previously married and is divorced with a child. and me and him now have a child together. as a family unit we run great and smoothly. when it involves are children are life is perfect. but between me and him we are having issues that are slowly escalating. i feel like in our relationship he lacks a lot of respect for me. when the children are not present he will cuss me out when upset, tell me to leave or think of the meanest thing he can say to hurt me. at first he told me he acted that way because are sexually life wasnt the best to be honest we have two kids and i am tired so i have tried to make an effort to make that better and his behaviors got better for a few days and then he is back acting this way. i have tried talking to him about it and again it will get better a few days then back to the same. i love him and dont get me wrong he is a good person and an amazing dad. i dont want to break up our family but i can feel myself becoming resentful and just avoiding him all together to avoid any confrontation. i am lost on what to do?","i have been with my fiance for the past 4 years. he was previously married and is divorced with a child. and me and him now have a child together. as a family unit we run great and smoothly. when it involves are children are life is perfect. but between me and him we are having issues that are slowly escalating. i feel like in our relationship he lacks a lot of respect for me. when the children are not present he will cuss me out when upset, tell me to leave or think of the meanest thing he can say to hurt me. at first he told me he acted that way because are sexually life"
pilot_0139,from a graduate student in the u.s. i have been in constant stress and feeling worried for the last 3 years. i have constant chest pain and extreme depression episodes where i cannot get out of bed or stop crying. i have no friends because i am embarrassed of myself and my decisions and dont want to expose myself as a fraud to anyone. i am also deathly afraid of being judged by others about my decisions. i have worked a little but struggled in that environment because i cannot concentrate because i feel others are saying or thinking bad things about me.,"its very difficult to believe that you are still in the same position. i can only imagine the pain and confusion that is making you feel like you are on the edge of death.i would recommend that you see a physician. a physician can determine what is wrong and make recommendations. the physician can then make a diagnosis and recommend treatment.if you are able to talk to a doctor, you might consider seeing a therapist to help you get some relief. the two of you might find it helpful to write back and ask for help.i wish you well."
pilot_0140,"i am writing you to ask for some serious advice, my husband has two daughters one, 18 years old, and the other 25, both are bipolar, especially his youngest daughter, now, for three years his older daughter lived with us which was supposed to be on a temp basis, i am glad she moved out, however, during her time with us, she would have extreme ups and really low downs as far as her moods, she could not control her emotions, i watched her have a mild break down over a broken iphone, she made excuses about everything in her life, she was good at reversing the truth, and showed serious signs of jealousy, she would stay in her room literally all day, never speaks, but when she was in a good mood she was pleasant, we could go to the grocery store laughing having fun, no sooner than we got home she would not speak?","well, I have a feeling that your husband is bipolar and does not have a good understanding of the issues that are being brought up with him. I have also had some people tell me that he is a good person, but I am not sure if that is true. I have seen a lot of people who have told me that they have bipolar and they are trying to get better, but they still don't know how to treat their patients, they are afraid of their doctor, and they are in a situation where they have to deal with their own doctor who has been told that he is bipolar, and they are worried about their family members"
pilot_0141,"well, my parents are pretty decent folks. they love me and deep down i know they do but sometimes in certain moments i dont feel like they do. i sometimes wonder if its because im a teenager or if i really do have some psych issue. even when the evidence that my family does love me should outweigh the the feeling that they dont, it isnt enough.","im sorry that you are experiencing this. you are correct that you are frightened. as you pointed out, you are not the only one who is scared. it is important that you get help. you can ask your parents for help in any way you like. ask them to assist you in seeking help. they will know what to do. if you are not willing to go, then they may not know how to help you. ask them to assist you in getting some help for yourself.if they dont know what to do, then they may not want to help you. if they dont know how to help you, then they may not"
pilot_0142,"from the u.s. im 20 years old and have been with my boyfriend for about 4 months. we started at the beginning of the spring semester after winter break. during winter break i had told my parents about him and that he had bipolar disorder and some other personal things about his life. they told me to stay away because i didnt need that kind of crazy in my life, and i, striving to be the perfect daughter, told them that i didnt like him anyway, even though i did. i just didnt want to cause any waves.","I've had bipolar disorder since I was 12 years old, but not much has changed in my life since then. I've been very successful in school and work, I have been an employee of the bank and I have been a member of the school board. I've also been a member of the local school board. I've always been very positive and I'm a very happy person. I've always been very good at my job, I'm very proud of my accomplishments and I'm very happy with the way I've been treated. I know i'm not the best person, but I'm a very happy person. I want to"
pilot_0143,"hi, i started puberty very late at the age of 16 12 to 17 yrs old and because of that i kinda became a loner. i had friends that i hanged out in school but i did nothing outside of school i just stayed home. the reason i stayed home was because of looking a lot younger then i really was, i looked like a 12 year old and actually i was a senior in high school. i tried to avoid contact with people because i was afraid that when they realized my age they would give me a look and i would feel extremely embarrassed. so i never went out, i never learned to drive, i never did anything, even my cousins would make fun of me. so now that im 20 years old i feel distant from my relatives i still stay at home because i cant drive and i still look younger than i actually am. i really want to get on with my life and make my own life, be independent but i cant shake off how i felt around people before. im still afraid of what people will think when they realize my age and its killing me that i cant get over that. please give me some advice as to how to get over whatever this is.","Hi, i was dating a guy who was a loner for a while, he was just a young loner and i started dating him because i was feeling like he was a loser. i was like, ""hey i'm not even that loner, i'm just a good kid, i can't even date someone like that. i don't know what to do with myself, i'm just a loner"". so i went to his apartment and started dating him. i was like, ""hey, i'm just a good kid, i can't even date someone like that. i can't even date people like that"""
